[
  {
    "eventId": 1000000001,
    "betOfferId": 1000000001,
    "betOfferType": "THREE_WAY",
    "line": 2.20,
    "outcomes": [
      {
        "outcomeId": 1000000003,
        "outcomeType": "THW_HOME_WIN",
        "odds": 1.35,
        "probability": 0.40,
        "outcomeName": "Bournemouth"
      },
      {
        "outcomeId": 1000000002,
        "outcomeType": "THW_AWAY_WIN",
        "odds": 1.88,
        "probability": 0.35,
        "outcomeName": "Newcastle United"
      },
      {
        "outcomeId": 1000000001,
        "outcomeType": "THW_DRAW",
        "odds": 2.12,
        "probability": 0.25,
        "outcomeName": "Draw"
      }
    ]
  },
  {
    "eventId": 1000000001,
    "betOfferId": 1000000002,
    "betOfferType": "OVER_UNDER",
    "line": 2.20,
    "outcomes": [
      {
        "outcomeId": 1000000005,
        "outcomeType": "OVER",
        "odds": 1.88,
        "probability": 0.35,
        "outcomeName": "Total Goals"
      },
      {
        "outcomeId": 1000000004,
        "outcomeType": "UNDER",
        "odds": 2.12,
        "probability": 0.25,
        "outcomeName": "Total Goals"
      }
    ]
  },
  {
    "eventId": 1000000002,
    "betOfferId": 1000000003,
    "betOfferType": "THREE_WAY",
    "line": 2.20,
    "outcomes": [
      {
        "outcomeId": 1000000008,
        "outcomeType": "THW_HOME_WIN",
        "odds": 1.35,
        "probability": 0.40,
        "outcomeName": "Burnley"
      },
      {
        "outcomeId": 1000000007,
        "outcomeType": "THW_AWAY_WIN",
        "odds": 1.88,
        "probability": 0.35,
        "outcomeName": "Leicester City"
      },
      {
        "outcomeId": 1000000006,
        "outcomeType": "THW_DRAW",
        "odds": 2.12,
        "probability": 0.25,
        "outcomeName": "Draw"
      }
    ]
  },
  {
    "eventId": 1000000002,
    "betOfferId": 1000000004,
    "betOfferType": "OVER_UNDER",
    "line": 2.20,
    "outcomes": [
      {
        "outcomeId": 1000000010,
        "outcomeType": "OVER",
        "odds": 1.88,
        "probability": 0.35,
        "outcomeName": "Total Goals"
      },
      {
        "outcomeId": 1000000009,
        "outcomeType": "UNDER",
        "odds": 2.12,
        "probability": 0.25,
        "outcomeName": "Total Goals"
      }
    ]
  },
  {
    "eventId": 1000000003,
    "betOfferId": 1000000005,
    "betOfferType": "THREE_WAY",
    "line": 2.20,
    "outcomes": [
      {
        "outcomeId": 1000000013,
        "outcomeType": "THW_HOME_WIN",
        "odds": 1.35,
        "probability": 0.40,
        "outcomeName": "West Ham"
      },
      {
        "outcomeId": 1000000012,
        "outcomeType": "THW_AWAY_WIN",
        "odds": 1.88,
        "probability": 0.35,
        "outcomeName": "Huddersfield Town"
      },
      {
        "outcomeId": 1000000011,
        "outcomeType": "THW_DRAW",
        "odds": 2.12,
        "probability": 0.25,
        "outcomeName": "Draw"
      }
    ]
  },
  {
    "eventId": 1000000003,
    "betOfferId": 1000000006,
    "betOfferType": "OVER_UNDER",
    "line": 2.20,
    "outcomes": [
      {
        "outcomeId": 1000000015,
        "outcomeType": "OVER",
        "odds": 1.88,
        "probability": 0.35,
        "outcomeName": "Total Goals"
      },
      {
        "outcomeId": 1000000014,
        "outcomeType": "UNDER",
        "odds": 2.12,
        "probability": 0.25,
        "outcomeName": "Total Goals"
      }
    ]
  },
  {
    "eventId": 1000000004,
    "betOfferId": 1000000007,
    "betOfferType": "THREE_WAY",
    "line": 2.20,
    "outcomes": [
      {
        "outcomeId": 1000000018,
        "outcomeType": "THW_HOME_WIN",
        "odds": 1.35,
        "probability": 0.40,
        "outcomeName": "Fulham"
      },
      {
        "outcomeId": 1000000017,
        "outcomeType": "THW_AWAY_WIN",
        "odds": 1.88,
        "probability": 0.35,
        "outcomeName": "Liverpool"
      },
      {
        "outcomeId": 1000000016,
        "outcomeType": "THW_DRAW",
        "odds": 2.12,
        "probability": 0.25,
        "outcomeName": "Draw"
      }
    ]
  },
  {
    "eventId": 1000000004,
    "betOfferId": 1000000008,
    "betOfferType": "OVER_UNDER",
    "line": 2.20,
    "outcomes": [
      {
        "outcomeId": 1000000020,
        "outcomeType": "OVER",
        "odds": 1.88,
        "probability": 0.35,
        "outcomeName": "Total Goals"
      },
      {
        "outcomeId": 1000000019,
        "outcomeType": "UNDER",
        "odds": 2.12,
        "probability": 0.25,
        "outcomeName": "Total Goals"
      }
    ]
  },
  {
    "eventId": 1000000005,
    "betOfferId": 1000000009,
    "betOfferType": "THREE_WAY",
    "line": 2.20,
    "outcomes": [
      {
        "outcomeId": 1000000023,
        "outcomeType": "THW_HOME_WIN",
        "odds": 1.35,
        "probability": 0.40,
        "outcomeName": "Everton"
      },
      {
        "outcomeId": 1000000022,
        "outcomeType": "THW_AWAY_WIN",
        "odds": 1.88,
        "probability": 0.35,
        "outcomeName": "Chelsea"
      },
      {
        "outcomeId": 1000000021,
        "outcomeType": "THW_DRAW",
        "odds": 2.12,
        "probability": 0.25,
        "outcomeName": "Draw"
      }
    ]
  },
  {
    "eventId": 1000000005,
    "betOfferId": 1000000010,
    "betOfferType": "OVER_UNDER",
    "line": 2.20,
    "outcomes": [
      {
        "outcomeId": 1000000025,
        "outcomeType": "OVER",
        "odds": 1.88,
        "probability": 0.35,
        "outcomeName": "Total Goals"
      },
      {
        "outcomeId": 1000000024,
        "outcomeType": "UNDER",
        "odds": 2.12,
        "probability": 0.25,
        "outcomeName": "Total Goals"
      }
    ]
  }
]